{
  "schema_version": "frankenjax.numerical-stability.v1",
  "bead_id": "frankenjax-cstq.20",
  "generated_at_unix_ms": 1792430484695,
  "status": "pass",
  "policy": "Numerical-stability green requires explicit tolerance policy, edge-condition class, guard path, platform fingerprint, non-finite classification, artifact hash binding, deterministic replay count, and exact replay command for every stability family. Tolerances may not be widened silently; unstable or stale rows must surface as issues.",
  "required_stability_families": [
    "special_math_tails",
    "linalg_near_singular",
    "ad_gradient_check",
    "fft_scaling",
    "dtype_promotion",
    "complex_branch_values",
    "rng_determinism",
    "literal_bit_roundtrip",
    "non_finite_division",
    "finite_diff_policy",
    "platform_metadata"
  ],
  "summary": {
    "required_family_count": 11,
    "observed_family_count": 11,
    "row_count": 11,
    "pass_count": 11,
    "tolerance_policy_count": 7,
    "platform_fingerprint_count": 1,
    "rows_with_platform": 11,
    "rows_with_artifacts": 11,
    "rows_with_replay": 11,
    "rows_with_non_finite_classification": 11,
    "deterministic_replay_rows": 11,
    "unstable_count": 0,
    "stale_count": 0,
    "regression_count": 0
  },
  "platform_fingerprints": [
    {
      "platform_id": "platform-linux-x86_64-little",
      "os": "linux",
      "arch": "x86_64",
      "endian": "little",
      "rust_version": "rustc 1.100.0-nightly (908501772 2026-08-30)",
      "cargo_version": "cargo 1.100.0-nightly (e8cb624d5 2026-08-22)",
      "cargo_target_dir": "/dev/shm/cargo-target-frankenjax",
      "deterministic_serialization": true
    }
  ],
  "tolerance_policies": [
    {
      "policy_id": "exact_bitwise",
      "dtype": "bits",
      "comparator": "exact_bitwise",
      "atol": 0.0,
      "rtol": 0.0,
      "ulp": 0,
      "finite_difference_step": null,
      "notes": "Literal bits, integer rows, RNG words, and NaN payload checks require exact byte-for-byte equality."
    },
    {
      "policy_id": "f64_default",
      "dtype": "f64",
      "comparator": "approx_atol_rtol",
      "atol": 1e-12,
      "rtol": 1e-10,
      "ulp": 4,
      "finite_difference_step": null,
      "notes": "Default double-precision comparisons stay tight enough to expose drift."
    },
    {
      "policy_id": "f32_default",
      "dtype": "f32",
      "comparator": "approx_atol_rtol",
      "atol": 0.00001,
      "rtol": 0.00001,
      "ulp": 16,
      "finite_difference_step": null,
      "notes": "Single-precision and half/bfloat rows use the established JAX-compatible f32 tier."
    },
    {
      "policy_id": "complex128_default",
      "dtype": "complex128",
      "comparator": "componentwise_atol_rtol",
      "atol": 1e-12,
      "rtol": 1e-10,
      "ulp": 8,
      "finite_difference_step": null,
      "notes": "Complex rows compare real and imaginary components independently."
    },
    {
      "policy_id": "f64_special_tail",
      "dtype": "f64",
      "comparator": "approx_atol_rtol",
      "atol": 1e-6,
      "rtol": 1e-6,
      "ulp": null,
      "finite_difference_step": null,
      "notes": "Special-function tail approximations have explicit wider tolerances and must name the approximation source."
    },
    {
      "policy_id": "f64_linalg_ill_conditioned",
      "dtype": "f64",
      "comparator": "approx_atol_rtol",
      "atol": 0.02,
      "rtol": 0.0001,
      "ulp": null,
      "finite_difference_step": 1.4901161193847656e-8,
      "notes": "Near-singular linalg gradient rows expose the wider finite-difference envelope instead of hiding it."
    },
    {
      "policy_id": "f64_grad_fd",
      "dtype": "f64",
      "comparator": "finite_difference_atol_rtol",
      "atol": 0.0001,
      "rtol": 0.0001,
      "ulp": null,
      "finite_difference_step": 1.4901161193847656e-8,
      "notes": "AD numerical verification rows must record the finite-difference step policy."
    }
  ],
  "rows": [
    {
      "case_id": "stability-special-math-tail-001",
      "family": "special_math_tails",
      "primitive_or_scope": "erf/logistic/log1p tail approximations",
      "dtype": "f64",
      "shape": [],
      "seed": null,
      "edge_condition_class": "tail_and_cancellation",
      "reference_source": "Abramowitz-Stegun approximation notes plus special-math oracle tests",
      "tolerance_policy_id": "f64_special_tail",
      "reference_scale": 1.0,
      "stability_guard": "named_polynomial_or_series_approximation",
      "expected_behavior": "tail values stay within the explicit special-function envelope",
      "actual_behavior": "existing special-math numerical tests stay inside the declared envelope",
      "max_abs_error": 1.2656542480726785e-14,
      "max_rel_error": 1.2656822076216872e-14,
      "max_ulp_error": null,
      "non_finite_classification": "finite",
      "deterministic_replay_count": 3,
      "platform_fingerprint_id": "platform-linux-x86_64-little",
      "artifact_refs": [
        "crates/fj-conformance/tests/ad_numerical_verification.rs",
        "crates/fj-conformance/tests/logistic_oracle.rs",
        "README.md"
      ],
      "replay_command": "cargo test -p fj-conformance --test ad_numerical_verification erf_vjp_numerical -- --nocapture",
      "dashboard_row": "stability/special_math_tails",
      "status": "pass",
      "stale": false,
      "regression": false
    },
    {
      "case_id": "stability-linalg-near-singular-001",
      "family": "linalg_near_singular",
      "primitive_or_scope": "cholesky/svd/eigh/triangular_solve gradients",
      "dtype": "f64",
      "shape": [
        3,
        3
      ],
      "seed": null,
      "edge_condition_class": "near_singular_or_clustered_spectrum",
      "reference_source": "finite-difference AD verification tests",
      "tolerance_policy_id": "f64_linalg_ill_conditioned",
      "reference_scale": 1.0,
      "stability_guard": "diagonal_and_eigenvalue_gap_guards",
      "expected_behavior": "ill-conditioned rows stay finite and within the named wider envelope",
      "actual_behavior": "near-singular Cholesky/SVD/Eigh rows use explicit guard paths",
      "max_abs_error": 1.003444882741178e-8,
      "max_rel_error": 2.845256758103356e-9,
      "max_ulp_error": null,
      "non_finite_classification": "finite",
      "deterministic_replay_count": 3,
      "platform_fingerprint_id": "platform-linux-x86_64-little",
      "artifact_refs": [
        "crates/fj-conformance/tests/ad_numerical_verification.rs"
      ],
      "replay_command": "cargo test -p fj-conformance --test ad_numerical_verification cholesky_vjp_near_singular -- --nocapture",
      "dashboard_row": "stability/linalg_near_singular",
      "status": "pass",
      "stale": false,
      "regression": false
    },
    {
      "case_id": "stability-ad-gradient-check-001",
      "family": "ad_gradient_check",
      "primitive_or_scope": "VJP/JVP/Jacobian/Hessian finite-difference verification",
      "dtype": "f64",
      "shape": [
        1
      ],
      "seed": null,
      "edge_condition_class": "finite_difference_step_governance",
      "reference_source": "AD numerical verification harness",
      "tolerance_policy_id": "f64_grad_fd",
      "reference_scale": 1.0,
      "stability_guard": "sqrt_epsilon_step_clamped_to_safe_range",
      "expected_behavior": "finite-difference comparisons use one documented step policy",
      "actual_behavior": "AD tests record and validate the bounded step envelope",
      "max_abs_error": 1.1613557893142001e-9,
      "max_rel_error": 1.1613557893142001e-9,
      "max_ulp_error": null,
      "non_finite_classification": "finite",
      "deterministic_replay_count": 3,
      "platform_fingerprint_id": "platform-linux-x86_64-little",
      "artifact_refs": [
        "crates/fj-conformance/tests/ad_numerical_verification.rs"
      ],
      "replay_command": "cargo test -p fj-conformance --test ad_numerical_verification sin_vjp_numerical -- --nocapture",
      "dashboard_row": "stability/ad_gradient_check",
      "status": "pass",
      "stale": false,
      "regression": false
    },
    {
      "case_id": "stability-fft-scaling-001",
      "family": "fft_scaling",
      "primitive_or_scope": "fft/ifft/rfft/irfft scaling",
      "dtype": "complex128",
      "shape": [
        4
      ],
      "seed": null,
      "edge_condition_class": "hermitian_scaling_and_inverse_normalization",
      "reference_source": "FFT AD numerical verification and oracle fixtures",
      "tolerance_policy_id": "complex128_default",
      "reference_scale": 1.0,
      "stability_guard": "exact_inverse_length_scaling",
      "expected_behavior": "inverse FFT and real FFT gradients preserve scaling",
      "actual_behavior": "FFT and IRFFT VJP tests stay in complex128 tolerance",
      "max_abs_error": 0.0,
      "max_rel_error": 0.0,
      "max_ulp_error": 0,
      "non_finite_classification": "finite",
      "deterministic_replay_count": 3,
      "platform_fingerprint_id": "platform-linux-x86_64-little",
      "artifact_refs": [
        "crates/fj-conformance/tests/ad_numerical_verification.rs",
        "artifacts/e2e/e2e_multirank_fixtures.e2e.json"
      ],
      "replay_command": "cargo test -p fj-conformance --test ad_numerical_verification fft_vjp_numerical -- --nocapture",
      "dashboard_row": "stability/fft_scaling",
      "status": "pass",
      "stale": false,
      "regression": false
    },
    {
      "case_id": "stability-dtype-promotion-001",
      "family": "dtype_promotion",
      "primitive_or_scope": "mixed integer/float/complex promotion lattice",
      "dtype": "mixed",
      "shape": [
        2
      ],
      "seed": null,
      "edge_condition_class": "mixed_dtype_exact_contract",
      "reference_source": "JAX dtype-promotion fixtures and mixed-dtype E2E log",
      "tolerance_policy_id": "exact_bitwise",
      "reference_scale": 1.0,
      "stability_guard": "dtype_lattice_row_must_match_oracle",